[
  {
    "finding_id": "GO-2026-6091",
    "original_status": "FAIL",
    "exception_status": "EXCEPTION",
    "owner": "security-team",
    "justification": "Vulnerability scanner flags this Go standard library advisory against the FIPS 140-3 boringcrypto build variant; the scanner does not yet recognize the boringcrypto suffix on the toolchain/module version string, producing a false-positive FAIL. Exempted pending scanner support for the suffix. See .release/security-scan.hcl suppress.vulnerabilities.",
    "expiry_date": "2026-12-31",
    "jira_reference": "PSP-3913",
    "created_at": "2026-09-27T00:00:00Z"
  },
  {
    "finding_id": "GO-2026-6088",
    "original_status": "FAIL",
    "exception_status": "EXCEPTION",
    "owner": "security-team",
    "justification": "Vulnerability scanner flags this Go standard library advisory against the FIPS 140-3 boringcrypto build variant; the scanner does not yet recognize the boringcrypto suffix on the toolchain/module version string, producing a false-positive FAIL. Exempted pending scanner support for the suffix. See .release/security-scan.hcl suppress.vulnerabilities.",
    "expiry_date": "2026-12-31",
    "jira_reference": "PSP-3913",
    "created_at": "2026-09-27T00:00:00Z"
  },
  {
    "finding_id": "GO-2026-5972",
    "original_status": "FAIL",
    "exception_status": "EXCEPTION",
    "owner": "security-team",
    "justification": "Vulnerability scanner flags this Go standard library advisory against the FIPS 140-3 boringcrypto build variant; the scanner does not yet recognize the boringcrypto suffix on the toolchain/module version string, producing a false-positive FAIL. Exempted pending scanner support for the suffix. See .release/security-scan.hcl suppress.vulnerabilities.",
    "expiry_date": "2026-12-31",
    "jira_reference": "PSP-3913",
    "created_at": "2026-09-27T00:00:00Z"
  },
  {
    "finding_id": "GO-2026-6218",
    "original_status": "FAIL",
    "exception_status": "EXCEPTION",
    "owner": "security-team",
    "justification": "Vulnerability scanner flags this Go standard library advisory against the FIPS 140-3 boringcrypto build variant; the scanner does not yet recognize the boringcrypto suffix on the toolchain/module version string, producing a false-positive FAIL. Exempted pending scanner support for the suffix. See .release/security-scan.hcl suppress.vulnerabilities.",
    "expiry_date": "2026-12-31",
    "jira_reference": "PSP-3913",
    "created_at": "2026-09-27T00:00:00Z"
  },
  {
    "finding_id": "GO-2026-6090",
    "original_status": "FAIL",
    "exception_status": "EXCEPTION",
    "owner": "security-team",
    "justification": "Vulnerability scanner flags this Go standard library advisory against the FIPS 140-3 boringcrypto build variant; the scanner does not yet recognize the boringcrypto suffix on the toolchain/module version string, producing a false-positive FAIL. Exempted pending scanner support for the suffix. See .release/security-scan.hcl suppress.vulnerabilities.",
    "expiry_date": "2026-12-31",
    "jira_reference": "PSP-3913",
    "created_at": "2026-09-27T00:00:00Z"
  },
  {
    "finding_id": "GO-2026-5026",
    "original_status": "FAIL",
    "exception_status": "EXCEPTION",
    "owner": "security-team",
    "justification": "Vulnerability scanner flags this Go standard library advisory against the FIPS 140-3 boringcrypto build variant; the scanner does not yet recognize the boringcrypto suffix on the toolchain/module version string, producing a false-positive FAIL. Exempted pending scanner support for the suffix. See .release/security-scan.hcl suppress.vulnerabilities.",
    "expiry_date": "2026-12-31",
    "jira_reference": "PSP-3913",
    "created_at": "2026-09-27T00:00:00Z"
  },
  {
    "finding_id": "GO-2026-6089",
    "original_status": "FAIL",
    "exception_status": "EXCEPTION",
    "owner": "security-team",
    "justification": "Vulnerability scanner flags this Go standard library advisory against the FIPS 140-3 boringcrypto build variant; the scanner does not yet recognize the boringcrypto suffix on the toolchain/module version string, producing a false-positive FAIL. Exempted pending scanner support for the suffix. See .release/security-scan.hcl suppress.vulnerabilities.",
    "expiry_date": "2026-12-31",
    "jira_reference": "PSP-3913",
    "created_at": "2026-09-27T00:00:00Z"
  },
  {
    "finding_id": "GO-2026-5942",
    "original_status": "FAIL",
    "exception_status": "EXCEPTION",
    "owner": "security-team",
    "justification": "Vulnerability scanner flags this Go standard library advisory against the FIPS 140-3 boringcrypto build variant; the scanner does not yet recognize the boringcrypto suffix on the toolchain/module version string, producing a false-positive FAIL. Exempted pending scanner support for the suffix. See .release/security-scan.hcl suppress.vulnerabilities.",
    "expiry_date": "2026-12-31",
    "jira_reference": "PSP-3913",
    "created_at": "2026-09-27T00:00:00Z"
  }
]
