[
  {
    "finding_id": "FIPS-CRYPTO-002",
    "original_status": "REVIEW",
    "exception_status": "EXCEPTION",
    "owner": "security-team",
    "justification": "sdk/helper/keysutil/policy.go retains a non-Approved algorithm import for backward-compatible reads of existing Transit keys; approved pending Phase 2 migration completion.",
    "expiry_date": "2099-12-31",
    "jira_reference": "PSP-1234",
    "created_at": "2026-01-01T00:00:00Z"
  },
  {
    "finding_id": "FIPS-TLS-001",
    "original_status": "FAIL",
    "exception_status": "EXCEPTION",
    "owner": "security-team",
    "justification": "Default cluster listener cipher suite list includes a non-Approved cipher; pending operator guidance rollout requiring an explicit cluster_cipher_suites override.",
    "expiry_date": "2099-12-31",
    "jira_reference": "PSP-1235",
    "created_at": "2026-01-02T00:00:00Z"
  }
]
